{
  "appointment_id": "appt_demo_001",
  "lead_id": "lead_demo_001",
  "calendar_event_id": "calendar_event_demo_001",
  "title": "Demo Scalvia - Clinica Demo Norte",
  "start_time": "2026-05-20T16:00:00-06:00",
  "end_time": "2026-05-20T16:30:00-06:00",
  "timezone": "America/Mexico_City",
  "status": "scheduled",
  "attendees": [
    {
      "name": "Dra. Demo",
      "email": "demo@example.com",
      "phone": "521XXXXXXXXXX"
    }
  ],
  "location": "Google Meet",
  "meeting_link": "https://meet.google.com/demo-demo-demo",
  "notes": "Demo sobre asistente de IA por WhatsApp para clinica.",
  "created_at": "2026-05-18T20:10:00-05:00",
  "updated_at": "2026-05-18T20:10:00-05:00"
}
